{
  "schemaVersion": "1.0.0",
  "bankId": "sample-mixed-bank",
  "title": "샘플 혼합형 문제은행",
  "version": "v1",
  "subject": "공통",
  "description": "사지선다형과 주관식 키워드 채점 예시 문제은행",
  "questions": [
    {
      "id": "sample-v1-q0001",
      "type": "single_choice",
      "subject": "행정법",
      "unit": "행정행위",
      "difficulty": 3,
      "stem": "다음 중 행정행위의 하자에 관한 설명으로 옳은 것은?",
      "choices": [
        { "id": "A", "text": "무효인 행정행위는 취소되기 전까지 효력이 있다." },
        { "id": "B", "text": "취소사유가 있는 행정행위는 권한 있는 기관이 취소하기 전까지 유효하다." },
        { "id": "C", "text": "부존재인 행정행위에도 공정력이 인정된다." },
        { "id": "D", "text": "중대명백설은 모든 하자를 취소사유로 본다." }
      ],
      "answer": ["B"],
      "explanation": "취소사유가 있는 행정행위는 취소되기 전까지 일단 유효한 것으로 취급된다.",
      "tags": ["행정법", "행정행위", "하자", "취소"],
      "status": "published"
    },
    {
      "id": "sample-v1-q0002",
      "type": "short_answer",
      "subject": "행정법",
      "unit": "행정행위",
      "difficulty": 2,
      "stem": "행정행위가 취소되기 전까지 유효한 것으로 통용되는 효력을 무엇이라고 하는가?",
      "answer": ["공정력"],
      "acceptedKeywords": ["공정력", "구성요건적 효력"],
      "explanation": "공정력은 행정행위에 하자가 있더라도 취소되기 전까지 일단 유효한 것으로 통용되는 효력이다.",
      "tags": ["행정법", "행정행위", "공정력"],
      "status": "published"
    },
    {
      "id": "sample-v1-q0003",
      "type": "single_choice",
      "subject": "데이터",
      "unit": "JSON",
      "difficulty": 1,
      "stem": "다음 중 JSON에서 문자열 값을 표현하는 올바른 방식은?",
      "choices": [
        { "id": "A", "text": "name: 홍길동" },
        { "id": "B", "text": "'name': '홍길동'" },
        { "id": "C", "text": "\"name\": \"홍길동\"" },
        { "id": "D", "text": "name = 홍길동" }
      ],
      "answer": ["C"],
      "explanation": "JSON의 key와 문자열 값은 큰따옴표로 감싸야 한다.",
      "tags": ["데이터", "JSON", "기초"],
      "status": "published"
    },
    {
      "id": "sample-v1-q0004",
      "type": "short_answer",
      "subject": "웹",
      "unit": "정적 호스팅",
      "difficulty": 2,
      "stem": "GitHub Pages 같은 정적 호스팅에서 사용자별 풀이 기록을 저장할 때 적합한 브라우저 저장소를 하나 쓰세요.",
      "answer": ["localStorage", "IndexedDB"],
      "acceptedKeywords": ["localstorage", "로컬스토리지", "indexeddb"],
      "explanation": "정적 사이트에서는 서버 DB 없이 브라우저의 localStorage나 IndexedDB에 개인 풀이 기록을 저장할 수 있다.",
      "tags": ["웹", "정적사이트", "브라우저저장소"],
      "status": "published"
    }
  ]
}
